{
  "i": 497,
  "t": "DREAMWALKER",
  "sv": 1,
  "ord": 260,
  "c": "KIT & CLASS MODS",
  "n": "Dream Walker Kit",
  "no": "Shaman kit",
  "u": "https://github.com/thisisulb/DreamWalkerShamanKit",
  "a": "thisisulb",
  "sum": "Dream Walker - A shaman kit that focuses on manipulating sleep, dreams and nightmares. For BGEE / BG2EE / EET",
  "tags": [
    "class"
  ],
  "ph": [
    "BG1",
    "SoD",
    "SoA",
    "ToB"
  ],
  "gh": {
    "o": "thisisulb",
    "r": "DreamWalkerShamanKit"
  },
  "dl": "https://github.com/thisisulb/DreamWalkerShamanKit",
  "au": "Lava Del'Vortel",
  "langs": {
    "en": 0
  },
  "co": [
    {
      "n": "Dream Walker Kit (main)",
      "no": "Discovered from web. Component details need verification.",
      "wf": "DREAMWALKER",
      "wp": "DREAMWALKER\\DREAMWALKER.TP2",
      "wc": 0,
      "wq": "discovered",
      "cn": 0
    }
  ]
}