{
  "i": 221,
  "t": "viconia",
  "sv": 1,
  "ord": 270,
  "c": "NPC EXPANSIONS",
  "n": "Viconia Friendship",
  "langs": {
    "en": 0,
    "fr": 1,
    "ru": 2,
    "zh-cn": 3
  },
  "no": "technically compatible with RE's Valygar romance, but not characterization wise. Just choose one or the other Viconia Friendship",
  "u": "https://github.com/SpellholdStudios/ViconiaFriendship/releases",
  "a": "K'aeloree; Lava Del'Vortel",
  "v": "v4.5",
  "sum": "Adds friendship conversations with Viconia throughout BG2. Explores her drow past and surface adaptation without romance.",
  "tags": [
    "npc",
    "story"
  ],
  "ph": [
    "SoA"
  ],
  "gh": {
    "o": "SpellholdStudios",
    "r": "ViconiaFriendship"
  },
  "au": "Kaeloree",
  "dl": "https://github.com/SpellholdStudios/ViconiaFriendship",
  "co": [
    {
      "n": "Viconia Friendship",
      "cn": 0,
      "wf": "viconia",
      "wp": "viconia\\VICONIA.TP2",
      "wc": 0,
      "wq": "exact",
      "games": [
        "bg2ee",
        "bgt",
        "eet",
        "tob"
      ],
      "tp2n": "Viconia Friendship"
    }
  ]
}