{
  "i": 113,
  "t": "c7-fixwheels",
  "sv": 1,
  "pfx": "C7",
  "ord": 50,
  "c": "QUEST MODS ToB",
  "n": "Fix Wheels of Prophecy",
  "u": "https://www.gibberlings3.net/forums/topic/30323-wheels-of-prophecy-updated-to-83/page/3/#findComment-333983",
  "a": "Crevsdaak",
  "sum": "Compatibility fix for Wheels of Prophecy. Install this after Wheels to resolve any scripting conflicts with other mods.",
  "tags": [
    "tweak",
    "quest",
    "story"
  ],
  "ph": [
    "ToB"
  ],
  "au": "CrevsDaak",
  "dl": "https://www.gibberlings3.net/forums/topic/30323-wheels-of-prophecy-updated-to-83/page/3/#findComment-333983",
  "no": "Compatibility fix for Wheels of Prophecy that resolves a variable bug preventing game completion. Required when running Wheels of Prophecy alongside Ascension.",
  "langs": {
    "en": 0
  },
  "co": [
    {
      "n": "Fix variable bug preventing the player from finishing the game",
      "tp2n": "Fix variable bug preventing the player from finishing the game",
      "cn": 666,
      "wf": "c7-fixwheels",
      "wp": "c7-fixwheels\\c7-fixwheels.tp2",
      "wc": 666,
      "no": "Fixes variable bug preventing game completion in Wheels of Prophecy."
    }
  ]
}