{
  "i": 15,
  "t": "LeUI-SoD",
  "sv": 1,
  "ord": 20,
  "c": "INTERFACE",
  "n": "Lefreut's Enhanced UI (SoD skin)",
  "no": "Lefreut's SoD Enhanced LeUI Can also be installed after EET_End in the Post-EET phase. Known issue: adds 'sequence' keyword in label blocks of UI.MENU which causes Infinity Loader parse warning (cosmetic only, game still works)",
  "ic": "Other UI overhauls",
  "conflicts": [
    {
      "with": "LEUI-BG1EE",
      "withId": 14,
      "severity": "hard",
      "reason": "UI overhaul mods are mutually exclusive",
      "evidenceLevel": "mechanism-verified"
    },
    {
      "with": "LeUI",
      "withId": 16,
      "severity": "hard",
      "reason": "UI overhaul mods are mutually exclusive",
      "evidenceLevel": "mechanism-verified"
    },
    {
      "with": "infinity_ui",
      "withId": 17,
      "severity": "hard",
      "reason": "UI overhaul mods are mutually exclusive",
      "evidenceLevel": "mechanism-verified"
    },
    {
      "with": "eeuitweaks",
      "withId": 18,
      "severity": "soft",
      "reason": "These specific EEUITweaks components FORBID LeUI-SoD because LeUI already includes their features. Other EEUITweaks components (Hidden Game Options, chargen utilities, Quick Loot) are fully compatible. WeiDU auto-skips the incompatible components if LeUI-SoD is detected — safe to have both mods in a preset.",
      "myComps": "#0 Core component",
      "theirComps": "#1080 Portrait Picker #1090 #1091 CharGen Screens #2020 Message Box Resize #2040 Level Up Glow #2060 Dialog Box #2110 Keep Dialog #2900 Record Screen #3020 #3023 #3024 #3070 Journal #3028 #3030 Customize #3040-3045 Identify Items #3050 #3051 Inventory #4005 #4006 #4000 #4010 #4020 #4025 Store Tweaks #5000 Tooltip Scroll #5030 Scroll Bar #5040 #5041 Fonts",
      "orderOnly": true
    },
    {
      "with": "cdtweaks",
      "withId": 247,
      "severity": "soft",
      "reason": "cdtweaks Colorize NPC Names (cn:250-254) can corrupt NPC name strrefs in large installations, causing hover tooltips to show only HP without character names.",
      "theirComps": "#250-254 Colorize NPC Names",
      "evidenceLevel": "mechanism-verified"
    }
  ],
  "u": "https://github.com/r-e-d/LeUI-SoD/releases",
  "a": "Lefreut",
  "v": "4.9.1",
  "sum": "Replaces the default UI with a cleaner, more functional interface using the Siege of Dragonspear visual style. Same functional improvements as the BG1EE skin.",
  "tags": [
    "visual",
    "qol"
  ],
  "ph": [
    "BG1",
    "SoD",
    "SoA",
    "ToB"
  ],
  "ios": false,
  "gh": {
    "o": "r-e-d",
    "r": "LeUI-SoD"
  },
  "dl": "https://github.com/r-e-d/LeUI-SoD/releases",
  "au": "lefreut",
  "langs": {
    "en": 0
  },
  "co": [
    {
      "n": "lefreut's Enhanced UI (SoD skin) - Core component",
      "tp2n": "lefreut's Enhanced UI (SoD skin) - Core component",
      "cn": 0,
      "wf": "LeUI-SoD",
      "wp": "LeUI-SoD\\LEUI-SOD.TP2",
      "wc": 0,
      "wq": "exact",
      "games": [
        "bg2ee",
        "bgee",
        "eet",
        "sod"
      ]
    },
    {
      "n": "lefreut's Enhanced UI (SoD skin) - BG2 vanilla bams for spells",
      "tp2n": "lefreut's Enhanced UI (SoD skin) - BG2 vanilla bams for spells",
      "cn": 1,
      "wf": "LeUI-SoD",
      "wp": "LeUI-SoD\\LEUI-SOD.TP2",
      "wc": 1,
      "wq": "exact",
      "games": [
        "bg2ee",
        "bgee",
        "eet",
        "sod"
      ]
    },
    {
      "n": "lefreut's Enhanced UI (SoD skin) - BG2 vanilla fonts for descriptions",
      "tp2n": "lefreut's Enhanced UI (SoD skin) - BG2 vanilla fonts for descriptions",
      "cn": 2,
      "wf": "LeUI-SoD",
      "wp": "LeUI-SoD\\LEUI-SOD.TP2",
      "wc": 2,
      "wq": "exact",
      "games": [
        "bg2ee",
        "bgee",
        "eet",
        "sod"
      ]
    }
  ]
}
