{
  "i": 887,
  "t": "sigil_bd_mod",
  "sv": 1,
  "ord": 890,
  "c": "ITEM ADDITION MODS",
  "n": "Sigil's Birthday Mod",
  "langs": {
    "cs": 0,
    "en": 1,
    "fr": 2
  },
  "u": "https://github.com/Plutonium-X/MISC_Sigil",
  "a": "Sigil",
  "sum": "Funnily enough, this mod adds a new amulet to your inventory that lets you summon one of the 12 famous personalities from the Sigil forum.",
  "tags": [
    "item"
  ],
  "ph": [
    "BG1",
    "SoD",
    "SoA",
    "ToB"
  ],
  "dl": "https://github.com/Plutonium-X/MISC_Sigil",
  "no": "Funnily enough, this mod adds a new amulet to your inventory that lets you summon one of the 12 famous personalities from the Sigil forum.",
  "au": "Lava Del'Vortel",
  "co": [
    {
      "n": "Sigil's birthday mod",
      "cn": 0,
      "wf": "sigil_bd_mod",
      "wp": "sigil_bd_mod\\setup-sigil_bd_mod.tp2",
      "wc": 0,
      "wq": "lcc-github"
    }
  ],
  "gh": {
    "o": "Plutonium-X",
    "r": "MISC_Sigil"
  }
}
