{
  "i": 904,
  "t": "c4Monk",
  "sv": 1,
  "ord": 505,
  "c": "KIT & CLASS MODS",
  "n": "Hunyuan Monk Kit",
  "langs": {
    "zh-cn": 0
  },
  "u": "https://github.com/robvoid/Hunyuan_Monk",
  "a": "c4_angel, spark_gs_gs",
  "sum": "Hunyuan is a Monk kit that can, for example, transform into a cloud, allowing him to recover a good number of health points.",
  "tags": [
    "kit"
  ],
  "ph": [
    "BG1",
    "SoD",
    "SoA",
    "ToB"
  ],
  "dl": "https://github.com/robvoid/Hunyuan_Monk",
  "no": "Hunyuan is a Monk kit that can, for example, transform into a cloud, allowing him to recover a good number of health points.",
  "au": "CecilKain",
  "co": [
    {
      "n": "Hunyuan Monk",
      "cn": 0,
      "wf": "c4Monk",
      "wp": "c4Monk\\c4Monk.tp2",
      "wc": 0,
      "wq": "lcc-github-fallback"
    }
  ],
  "gh": {
    "o": "robvoid",
    "r": "Hunyuan_Monk"
  }
}
