{
  "i": 738,
  "t": "shurininja",
  "sv": 1,
  "ord": 570,
  "c": "KIT & CLASS MODS",
  "n": "Shuri Ninja Kit",
  "langs": {
    "en": 0,
    "fr": 1
  },
  "u": "https://github.com/GwendolyneFreddy/Shuri-Ninja",
  "a": "Twinblades2",
  "sum": "This mod adds a new thief profile to the game, the shuri ninja, and offers two new components for EE games.",
  "tags": [
    "kit"
  ],
  "ph": [
    "BG1",
    "SoD",
    "SoA",
    "ToB"
  ],
  "dl": "https://github.com/GwendolyneFreddy/Shuri-Ninja",
  "no": "This mod adds a new thief profile to the game, the shuri ninja, and offers two new components for EE games.",
  "au": "Deratiseur",
  "co": [
    {
      "n": "Shuri Ninja Kit (legacy)",
      "cn": 10,
      "wf": "shurininja",
      "wp": "shurininja\\shurininja.tp2",
      "wc": 10,
      "wq": "lcc-github"
    },
    {
      "n": "Shuri Ninja Kit may not wear heavier armor than leather (EE only)",
      "cn": 20,
      "wf": "shurininja",
      "wp": "shurininja\\shurininja.tp2",
      "wc": 20,
      "wq": "lcc-github",
      "g": "Armor Restriction"
    },
    {
      "n": "Shuri Ninja Kit may not wear any armor (EE only)",
      "cn": 30,
      "wf": "shurininja",
      "wp": "shurininja\\shurininja.tp2",
      "wc": 30,
      "wq": "lcc-github",
      "g": "Armor Restriction"
    }
  ],
  "gh": {
    "o": "GwendolyneFreddy",
    "r": "Shuri-Ninja"
  }
}
