{
  "i": 797,
  "t": "Backstab-on-the-CC",
  "sv": 1,
  "ord": 610,
  "c": "ITEM ADDITION MODS",
  "n": "Backstab on the Copper Coronet",
  "langs": {
    "fr": 0
  },
  "u": "https://github.com/11jo/Backstab-on-the-CC/",
  "a": "JohnBob",
  "sum": "This mod adds a vendor on the roof of the Copper Coronet, where you can purchase thieves' tablets for a few gold coins.",
  "tags": [
    "tweak"
  ],
  "ph": [
    "BG1",
    "SoD",
    "SoA",
    "ToB"
  ],
  "dl": "https://github.com/11jo/Backstab-on-the-CC/",
  "no": "This mod adds a vendor on the roof of the Copper Coronet, where you can purchase thieves' tablets for a few gold coins.",
  "au": "Gwendolyne",
  "co": [
    {
      "n": "Ce mod necessite BHEE / BG2ToB / BGT ou BG2EE / EET",
      "cn": 1,
      "wf": "Backstab-on-the-CC",
      "wp": "Backstab-on-the-CC\\Backstab-on-the-CC.TP2",
      "wc": 1,
      "wq": "lcc-github",
      "g": "Group 5002"
    },
    {
      "n": "Sneaky: No delay between backstabs",
      "cn": 2,
      "wf": "Backstab-on-the-CC",
      "wp": "Backstab-on-the-CC\\Backstab-on-the-CC.TP2",
      "wc": 2,
      "wq": "lcc-github",
      "g": "Group 5002"
    },
    {
      "n": "Villain: No need to be behind or invisible for backstab",
      "cn": 8,
      "wf": "Backstab-on-the-CC",
      "wp": "Backstab-on-the-CC\\Backstab-on-the-CC.TP2",
      "wc": 8,
      "wq": "lcc-github",
      "g": "Group 5002"
    },
    {
      "n": "DD 3.5 Backstab delay: 1 round",
      "cn": 3,
      "wf": "Backstab-on-the-CC",
      "wp": "Backstab-on-the-CC\\Backstab-on-the-CC.TP2",
      "wc": 3,
      "wq": "lcc-github",
      "g": "Group 5011"
    },
    {
      "n": "DD 3.5 Backstab delay: 2 rounds",
      "cn": 4,
      "wf": "Backstab-on-the-CC",
      "wp": "Backstab-on-the-CC\\Backstab-on-the-CC.TP2",
      "wc": 4,
      "wq": "lcc-github",
      "g": "Group 5011"
    },
    {
      "n": "DD 3.5 Backstab delay: 3 rounds",
      "cn": 5,
      "wf": "Backstab-on-the-CC",
      "wp": "Backstab-on-the-CC\\Backstab-on-the-CC.TP2",
      "wc": 5,
      "wq": "lcc-github",
      "g": "Group 5011"
    },
    {
      "n": "DD 3.5 Backstab delay: 4 rounds",
      "cn": 6,
      "wf": "Backstab-on-the-CC",
      "wp": "Backstab-on-the-CC\\Backstab-on-the-CC.TP2",
      "wc": 6,
      "wq": "lcc-github",
      "g": "Group 5011"
    },
    {
      "n": "No delay between backstabs",
      "cn": 7,
      "wf": "Backstab-on-the-CC",
      "wp": "Backstab-on-the-CC\\Backstab-on-the-CC.TP2",
      "wc": 7,
      "wq": "lcc-github",
      "g": "Group 5011"
    }
  ],
  "gh": {
    "o": "11jo",
    "r": "Backstab-on-the-CC"
  }
}
