{
  "i": 807,
  "t": "JOsterNoMore",
  "sv": 1,
  "ord": 620,
  "c": "POST-TACTICAL TWEAKS",
  "n": "JOster No More",
  "langs": {
    "fr": 0
  },
  "u": "https://github.com/11jo/JOster_NoMore/",
  "a": "11jo",
  "sum": "Tired of returning to the Thieves' Guild every five days? This mod lets you return to the guild for a few moments to settle accounts with Joster the Shadow Thief Collector.",
  "tags": [
    "tweak"
  ],
  "ph": [
    "BG1",
    "SoD",
    "SoA",
    "ToB"
  ],
  "dl": "https://github.com/11jo/JOster_NoMore/",
  "no": "Tired of returning to the Thieves' Guild every five days? This mod lets you return to the guild for a few moments to settle accounts with Joster the Shadow Thief Collector.",
  "au": "K4thos",
  "co": [
    {
      "n": "Install \"JOsterNoMore\" full",
      "cn": 0,
      "wf": "JOsterNoMore",
      "wp": "JOsterNoMore\\Setup-JOsterNoMore.bak.tp2",
      "wc": 0,
      "wq": "lcc-github"
    }
  ],
  "gh": {
    "o": "11jo",
    "r": "JOster_NoMore"
  }
}
