{
  "i": 814,
  "t": "regainrangerhood",
  "sv": 1,
  "ord": 690,
  "c": "POST-TACTICAL TWEAKS",
  "n": "Regain Rangerhood/Paladinhood",
  "langs": {
    "de": 0,
    "en": 1
  },
  "u": "https://github.com/Gitjas/Regaim_Rangerhood_Paladinhood_Cheatmod/",
  "a": "jastey",
  "sum": "This mod restores the PC's class/kit if he has fallen as a Ranger or Paladin. The reputation of the party is simultaneously raised to 10 if it is lower than 10.|This is a cheat mod to revers and un...",
  "tags": [
    "tweak"
  ],
  "ph": [
    "BG1",
    "SoD",
    "SoA",
    "ToB"
  ],
  "dl": "https://github.com/Gitjas/Regaim_Rangerhood_Paladinhood_Cheatmod/",
  "no": "This mod restores the PC's class/kit if he has fallen as a Ranger or Paladin. The reputation of the party is simultaneously raised to 10 if it is lower than 10.|This is a cheat mod to revers and un...",
  "au": "SubtleD",
  "co": [
    {
      "n": "Activate via Cheats",
      "cn": 0,
      "wf": "regainrangerhood",
      "wp": "regainrangerhood\\regainrangerhood.tp2",
      "wc": 0,
      "wq": "lcc-github",
      "g": "Activation Method"
    },
    {
      "n": "Redeem automatically",
      "cn": 1,
      "wf": "regainrangerhood",
      "wp": "regainrangerhood\\regainrangerhood.tp2",
      "wc": 1,
      "wq": "lcc-github",
      "g": "Activation Method"
    }
  ],
  "gh": {
    "o": "Gitjas",
    "r": "Regaim_Rangerhood_Paladinhood_Cheatmod"
  }
}
