{
  "i": 240,
  "t": "SkitiaRomanceTweak",
  "sv": 1,
  "pfx": "X3",
  "ord": 460,
  "c": "PRE-TACTICAL TWEAKS",
  "n": "Skitia Romance Tweak",
  "langs": {
    "en": 0,
    "it": 1,
    "ru": 2
  },
  "no": "sensible, but no reason to use it until the mod introduces more romance expansions Skitia's Romance Tweak for BG2:EE",
  "u": "https://github.com/Skitia/SkitiaBG2RomanceTweaks",
  "a": "Skitia",
  "v": "1.0",
  "sum": "This mod adjusts the original BG2 romances to be a bit less harsh when you separate from a romanceable companion for a while.",
  "tags": [
    "npc",
    "romance"
  ],
  "ph": [
    "SoA",
    "ToB"
  ],
  "gh": {
    "o": "Skitia",
    "r": "SkitiaBG2RomanceTweaks"
  },
  "dl": "https://github.com/Skitia/SkitiaBG2RomanceTweaks",
  "au": "Skitia",
  "co": [
    {
      "n": "Skitia's Romance Tweak for BG2:EE",
      "tp2n": "Skitia's Romance Tweak for BG2:EE",
      "cn": 0,
      "wf": "SkitiaRomanceTweak",
      "wp": "SkitiaRomanceTweak\\Setup-SkitiaRomanceTweak.tp2",
      "wc": 0,
      "wq": "verified"
    }
  ]
}