{
  "i": 90,
  "t": "l#isnf",
  "sv": 1,
  "pfx": "L#",
  "ord": 280,
  "c": "QUEST MODS BG2",
  "n": "Colours of Infinity: I Shall Never Forget",
  "langs": {
    "en": 0,
    "pl": 1,
    "fr": 2,
    "de": 3,
    "it": 4,
    "zh-cn": 5,
    "ru": 6,
    "ko": 7
  },
  "u": "https://downloads.weaselmods.net/download/i-shall-never-forget/",
  "a": "Lava Del'Vortel",
  "v": "6.5.4",
  "sum": "Short BG2 story mod focused on memory and loss. Dialogue-driven with atmospheric storytelling. Part of the Colours of Infinity series.",
  "tags": [
    "story"
  ],
  "ph": [
    "SoA"
  ],
  "dl": "https://downloads.weaselmods.net/download/i-shall-never-forget/",
  "au": "Lava",
  "no": "Short BG2 story mod focused on memory and loss. Dialogue-driven with atmospheric storytelling. Part of the Colours of Infinity series.",
  "co": [
    {
      "n": "Colours of Infinity: I Shall Never Forget",
      "tp2n": "Colours of Infinity: I Shall Never Forget",
      "pi": "L#-ISNF",
      "wf": "ISNF",
      "wp": "ISNF\\ISNF.tp2",
      "wc": 0,
      "wq": "manual_final",
      "cn": 0,
      "no": "I Shall Never Forget: a quest about memory and loss."
    }
  ]
}