{
  "i": 279,
  "t": "Galeforce_of_FaenyaDail",
  "sv": 1,
  "ord": 250,
  "c": "ITEM ADDITION MODS",
  "n": "Galeforce of FaenyaDail",
  "no": "Probably ok with other IWD items in BG1EE mods? Galeforce of Faenya-Dail",
  "u": "https://forums.beamdog.com/discussion/comment/1084485/#Comment_1084485",
  "a": "Tresset",
  "sum": "Adds a new longbow with unlimited ammo, a knockback effect, and a once-per-day Call Lightning charge ability.",
  "tags": [
    "item"
  ],
  "ph": [
    "SoA",
    "ToB"
  ],
  "dl": "https://forums.beamdog.com/discussion/comment/1084485/#Comment_1084485",
  "au": "Lava Del'Vortel",
  "langs": {
    "en": 0
  },
  "co": [
    {
      "n": "Galeforce of Faenya-Dail",
      "cn": 0,
      "wf": "Galeforce_of_FaenyaDail",
      "wp": "Galeforce_of_FaenyaDail\\setup-Galeforce_of_FaenyaDail.tp2",
      "wc": 0,
      "wq": "verified"
    }
  ]
}