{
  "i": 215,
  "t": "minscfriendship",
  "sv": 1,
  "pfx": "L#",
  "ord": 210,
  "c": "NPC EXPANSIONS",
  "n": "Minsc Friendship",
  "langs": {
    "en": 0,
    "ru": 1,
    "es": 2
  },
  "no": "Adds friendship conversations with Minsc throughout BG2. More depth to the beloved ranger beyond 'Go for the eyes, Boo!'",
  "u": "https://github.com/SpellholdStudios/MinscFriendship/releases",
  "a": "K'aeloree, Lava Del'Vortel, ArtemiusI",
  "v": "v1.3",
  "sum": "Adds friendship conversations with Minsc throughout BG2. More depth to the beloved ranger beyond 'Go for the eyes, Boo!'",
  "tags": [
    "npc",
    "story"
  ],
  "ph": [
    "SoA"
  ],
  "gh": {
    "o": "SpellholdStudios",
    "r": "MinscFriendship"
  },
  "au": "Lava Del'Vortel, Kaeloree and AionZ (aka Artemius_I)",
  "dl": "https://github.com/SpellholdStudios/MinscFriendship",
  "co": [
    {
      "n": "Minsc Friendship for BG2 and ToB",
      "pi": "minsc_friendship",
      "wf": "minscfriendship",
      "wp": "minscfriendship\\MINSCFRIENDSHIP.TP2",
      "wc": 0,
      "wq": "name_match",
      "cn": 0,
      "tp2n": "Minsc Friendship for BG2 and ToB"
    }
  ]
}