{
  "i": 811,
  "t": "mnkoverhaul",
  "sv": 1,
  "ord": 545,
  "c": "KIT & CLASS MODS",
  "n": "Monk Overhaul",
  "langs": {
    "en": 0
  },
  "u": "https://github.com/dark0dave/mnkoverhaul/",
  "a": "Kish, Prismo",
  "sum": "Did you like the `High-level monk abilities` component of the Oversight mod? Then this mod is for you: it takes its content and makes it compatible with EE games.",
  "tags": [
    "tweak"
  ],
  "ph": [
    "BG1",
    "SoD",
    "SoA",
    "ToB"
  ],
  "dl": "https://github.com/dark0dave/mnkoverhaul/",
  "no": "Did you like the `High-level monk abilities` component of the Oversight mod? Then this mod is for you: it takes its content and makes it compatible with EE games.",
  "au": "Deratiseur",
  "co": [
    {
      "n": "Monk High Level Abilities by Kish",
      "cn": 0,
      "wf": "mnkoverhaul",
      "wp": "mnkoverhaul\\mnkoverhaul.tp2",
      "wc": 0,
      "wq": "lcc-github",
      "g": "Monk HLAs"
    },
    {
      "n": "Monk High Level Abilities by Kish",
      "cn": 1,
      "wf": "mnkoverhaul",
      "wp": "mnkoverhaul\\mnkoverhaul.tp2",
      "wc": 1,
      "wq": "lcc-github",
      "g": "Monk HLAs"
    },
    {
      "n": "Monk Fist Overhaul",
      "cn": 2,
      "wf": "mnkoverhaul",
      "wp": "mnkoverhaul\\mnkoverhaul.tp2",
      "wc": 2,
      "wq": "lcc-github"
    }
  ],
  "gh": {
    "o": "dark0dave",
    "r": "mnkoverhaul"
  }
}
