{
  "i": 843,
  "t": "BWS-FR-Fixpack",
  "sv": 1,
  "ord": 70,
  "c": "RESTORATIONS",
  "n": "Big World Setup FR Fixpack",
  "u": "https://github.com/Selphira/BWS-FR-Fixpack",
  "a": "Selphira",
  "sum": "BWS-FR Fixpack is a compilation of patches, originally intended for Big World Setup FR, but which can also be used independently.",
  "tags": [
    "fix"
  ],
  "ph": [
    "BG1",
    "SoD",
    "SoA",
    "ToB"
  ],
  "dl": "https://github.com/Selphira/BWS-FR-Fixpack",
  "no": "BWS-FR Fixpack is a compilation of patches, originally intended for Big World Setup FR, but which can also be used independently.",
  "au": "Ulb",
  "langs": {
    "en": 0
  },
  "co": [
    {
      "n": "Application des patches sur les mods contenus dans le dossier du jeu",
      "cn": 0,
      "wf": "BWS-FR-Fixpack",
      "wp": "BWS-FR-Fixpack\\BWS-FR-Fixpack.tp2",
      "wc": 0,
      "wq": "lcc-github",
      "no": "Apply French translation patches to installed mods"
    },
    {
      "n": "Vérification de problèmes connus",
      "cn": 1,
      "wf": "BWS-FR-Fixpack",
      "wp": "BWS-FR-Fixpack\\BWS-FR-Fixpack.tp2",
      "wc": 1,
      "wq": "lcc-github",
      "no": "Check for known French translation issues"
    }
  ],
  "gh": {
    "o": "Selphira",
    "r": "BWS-FR-Fixpack"
  }
}
