{
  "i": 73,
  "t": "slandor",
  "sv": 1,
  "ord": 110,
  "c": "QUEST MODS BG2",
  "n": "The Minotaur and Lilacor",
  "langs": {
    "de": 0,
    "en": 1,
    "fr": 2,
    "it": 3,
    "ru": 4,
    "es": 5,
    "pl": 6,
    "zh-cn": 7
  },
  "no": "The Minotaur and Lilacor Not a bad idea but a tad expodumpy for such a small bit of lore.",
  "u": "https://github.com/SpellholdStudios/The_Minotaur_and_Lilacor",
  "a": "Yovaneth",
  "v": "2.1",
  "sum": "This mod adds a small backstory to the minotaur who reveals just what he and the three dead bodies are doing in Athkatla's sewers.",
  "tags": [
    "story"
  ],
  "ph": [
    "SoA"
  ],
  "gh": {
    "o": "SpellholdStudios",
    "r": "The_Minotaur_and_Lilacor"
  },
  "dl": "https://github.com/SpellholdStudios/The_Minotaur_and_Lilacor",
  "au": "Yovaneth",
  "co": [
    {
      "n": "The Minotaur and Lilacor",
      "tp2n": "Der Minotaurus und Lilarcor",
      "pi": "the_minautor_and_lilacor",
      "wf": "slandor",
      "wp": "slandor\\SLANDOR.TP2",
      "wc": 0,
      "wq": "name_match",
      "games": [
        "bg2",
        "bg2ee",
        "bgt",
        "eet",
        "tob"
      ],
      "cn": 0,
      "no": "The Minotaur and Lilacor: quest with the talking sword."
    }
  ]
}