{
  "i": 743,
  "t": "wladca",
  "sv": 1,
  "ord": 575,
  "c": "KIT & CLASS MODS",
  "n": "Master of Elements Kit",
  "langs": {
    "pl": 0,
    "fr": 1
  },
  "u": "https://github.com/Plutonium-X/KIT_Elements",
  "a": "Aroc",
  "sum": "This mod adds a Druid profile, the Master of the Elements.",
  "tags": [
    "kit"
  ],
  "ph": [
    "BG1",
    "SoD",
    "SoA",
    "ToB"
  ],
  "dl": "https://github.com/Plutonium-X/KIT_Elements",
  "no": "This mod adds a Druid profile, the Master of the Elements.",
  "au": "Lava Del'Vortel",
  "co": [
    {
      "n": "Druid kit",
      "cn": 0,
      "wf": "wladca",
      "wp": "wladca\\Setup-wladca.tp2",
      "wc": 0,
      "wq": "lcc-github"
    }
  ],
  "gh": {
    "o": "Plutonium-X",
    "r": "KIT_Elements"
  }
}
